{
  "profile_id": "caesar_cold_2026yeosu",
  "profile_version": "1.2.0",
  "base": "caesar_cold_base",
  "description": "CAESAR Cold-cavity raw layout (2026 Yeosu). PRIMARY=NO2 cell 1채널. core/raw_parser.py의 VALUE-INSPECTION 기록에서 파생한 기본 프로파일 — 값은 캠페인별로 복제·조정.",
  "kind": "cold",
  "campaign": "2026-yeosu",
  "channels": [
    {
      "id": "ch0",
      "label": "legacy-ch3",
      "role": "noise"
    },
    {
      "id": "ch1",
      "label": "NO2",
      "role": "signal",
      "cavity": {
        "pressure_hk": [
          "p_cavity"
        ],
        "temperature_hk": [
          "t_cavity",
          "t_spectrometer"
        ]
      },
      "concentration": {
        "allow_negative_gas": false,
        "fitset_path": "C:/Doasis_Work/Output/fit setting/FitSet_ANs[430-466nm_P4]_PNs[444-471nm_P3]_cold[438-466nm_P4]_Std.json",
        "wl_dir": "cold",
        "target": "NO2",
        "throttle_sec": 10,
        "seed_narrow_px": 2.0,
        "alert": {
          "conc_max_ppb": 100,
          "spike_ppb": 20,
          "rms_alarm": 5e-08,
          "flatline_n": 5
        }
      },
      "reflectance": {
        "wavecal_path": "C:/Doasis_Work/Output/wv_cal/cold/Calib_20260523_Hg_4line_400-497nm_Poly2.txt",
        "roi_nm": [
          438.0,
          476.0
        ],
        "cavity_len_cm": 51.8,
        "rl_factor": 0.933,
        "alert": {
          "warn_drop": 2e-05,
          "alarm_drop": 0.0001
        }
      }
    },
    {
      "id": "ch2",
      "label": "noise",
      "role": "noise"
    }
  ]
}
